Company Name,Decision Maker,Title,Email,Phone,City,Province,Industry,Carrier (Est.),Relationship,Talking Points,Lead Type,Call Notes
Maple Ridge Distributors,Sarah Chen,VP of Operations,schen@mapleridgedist.ca,(604) 555-0142,Burnaby,BC,Industrial / Distribution,FedEx,current,"Ships ~400 parcels/week across Western Canada; mentioned rising fuel surcharges from current carrier.",REACTIVATION,"On the call she flagged inconsistent transit times to the Prairies and wants a Q3 rate review."
Northwind Medical Supply,Daniel Okafor,Director of Logistics,dokafor@northwindmed.com,(416) 555-0188,Mississauga,ON,Healthcare / Medical Supply,UPS,lapsed,"Temperature-sensitive shipments; previously shipped with Purolator until 2022.",REACTIVATION,
Prairie Goods Co.,,Purchasing Manager,orders@prairiegoods.ca,(306) 555-0110,Regina,SK,Retail / E-Commerce,Unknown,current,"Growing DTC brand, 50+ employees, expanding fulfillment east.",NEW,
Coastline Electronics,Priya Nair,COO,pnair@coastlineelec.ca,,Halifax,NS,Technology / Hardware,FedEx,past,"Hardware manufacturer; last shipped with Purolator several years ago.",NEW,"Spoke briefly — open to a fresh look but wants to see domestic transit data vs FedEx."
Lakeshore Wholesale,Marc Tremblay,Operations Manager,mtremblay@lakeshorewholesale.ca,(514) 555-0173,Laval,QC,Industrial / Distribution,FedEx/UPS,current,"Bilingual operation, ships across QC and ON daily; values French-language support.",NEW,
